{
  "schemaVersion": 3,
  "activeRoute": "pi-ai",
  "routes": {
    "pi-ai": {
      "agents": {
        "main":    { "model": "deepseek/deepseek-v4-flash", "provider": "openrouter" },
        "dreamy":  { "model": "deepseek/deepseek-v4-flash", "provider": "openrouter" },
        "browsie": { "model": "deepseek/deepseek-v4-flash", "provider": "openrouter" },
        "cody":    { "model": "deepseek/deepseek-v4-flash", "provider": "openrouter" }
      },
      "fallbacks": [
        { "model": "google/gemini-2.5-flash", "provider": "openrouter" }
      ]
    },
    "acp": {
      "agents": {
        "main":    { "model": "claude-sonnet-4.6",  "provider": "kiro" },
        "dreamy":  { "model": "claude-sonnet-4.6",  "provider": "kiro" },
        "browsie": { "model": "claude-sonnet-4.6",  "provider": "kiro" },
        "cody":    { "model": "claude-sonnet-4.6",  "provider": "kiro" }
      },
      "fallbacks": []
    }
  },
  "providers": {
    "kiro":        { "transport": "acp", "cli": "kiro-cli" },
    "gemini":      { "transport": "acp", "cli": "gemini" },
    "ollama":      { "transport": "api", "endpoint": "http://localhost:11434/v1" },
    "openrouter":  { "transport": "api", "endpoint": "https://openrouter.ai/api/v1", "apiKeyEnv": "OPENROUTER_API_KEY" },
    "nvidia":      { "transport": "api", "endpoint": "https://integrate.api.nvidia.com/v1", "apiKeyEnv": "NVIDIA_API_KEY" }
  },
  "transportDefaults": {
    "acp":  { "permissionTimeoutMs": 60000 }
  },
  "maxTurns": 50,
  "healthPolicy": {
    "skipThreshold": 0.7,
    "leakPerMinute": 0.03,
    "authFill": 1.0,
    "authSticky": true,
    "rateLimitFill": 0.5,
    "weakFill": 0.05,
    "transientProgressive": [0.1, 0.2, 0.4, 0.8],
    "transientCooldownAfter": 3,
    "transientMaxCooldownSec": 300
  }
}
